{
  "schema_version": "1.0.0",
  "run_id": "nano-todo",
  "mode": "nano",
  "current_stage": null,
  "stage_status": {
    "s_in": "accepted",
    "s00_intake": "accepted",
    "s0_vision": "accepted",
    "s1_spec": "accepted",
    "s15_quarantine": "accepted",
    "s2_architecture": "accepted",
    "s3_plan": "accepted",
    "s4_build": "accepted",
    "s5_acceptance": "accepted",
    "s6_security": "accepted",
    "s7_release": "accepted",
    "s8_docs": "accepted",
    "s9_learn": "accepted"
  },
  "gate_status": {
    "gate_s_in": {
      "status": "approved",
      "approver": "system",
      "decided_by": "system:greenfield",
      "decided_at": "2026-10-29T15:44:51Z",
      "evidence": [
        "greenfield mode: s_in not applicable"
      ],
      "attempts": 0
    },
    "gate_s00": {
      "status": "approved",
      "approver": "human",
      "decided_by": "human:example",
      "decided_at": "2026-10-29T15:44:53Z",
      "evidence": [
        "interview accepted"
      ],
      "attempts": 0
    },
    "gate_s0": {
      "status": "approved",
      "approver": "human",
      "decided_by": "human:example",
      "decided_at": "2026-10-29T15:44:55Z",
      "evidence": [
        "vision accepted"
      ],
      "attempts": 0
    },
    "gate_s1": {
      "status": "approved",
      "approver": "human",
      "decided_by": "human:example",
      "decided_at": "2026-10-29T15:44:56Z",
      "evidence": [
        "spec-human approved"
      ],
      "attempts": 0
    },
    "gate_s15": {
      "status": "approved",
      "approver": "02-independent-verifier",
      "decided_by": "02-independent-verifier",
      "decided_at": "2026-10-29T15:44:57Z",
      "evidence": [
        "no external skills"
      ],
      "attempts": 0
    },
    "gate_s2": {
      "status": "approved",
      "approver": "02-independent-verifier",
      "decided_by": "02-independent-verifier",
      "decided_at": "2026-10-29T15:44:59Z",
      "evidence": [
        "architecture frozen"
      ],
      "attempts": 0
    },
    "gate_s3": {
      "status": "approved",
      "approver": "02-independent-verifier",
      "decided_by": "02-independent-verifier",
      "decided_at": "2026-10-29T15:45:00Z",
      "evidence": [
        "plan imported"
      ],
      "attempts": 0
    },
    "gate_s4": {
      "status": "approved",
      "approver": "02-independent-verifier",
      "decided_by": "02-independent-verifier",
      "decided_at": "2026-10-29T15:45:03Z",
      "evidence": [
        "all tasks accepted"
      ],
      "attempts": 0
    },
    "gate_s5": {
      "status": "approved",
      "approver": "02-independent-verifier",
      "decided_by": "02-independent-verifier",
      "decided_at": "2026-10-29T15:45:05Z",
      "evidence": [
        "100% PASS"
      ],
      "attempts": 0
    },
    "gate_s6": {
      "status": "approved",
      "approver": "02-independent-verifier",
      "decided_by": "02-independent-verifier",
      "decided_at": "2026-10-29T15:45:07Z",
      "evidence": [
        "no Critical/High"
      ],
      "attempts": 0
    },
    "gate_s7": {
      "status": "approved",
      "approver": "human",
      "decided_by": "human:example",
      "decided_at": "2026-10-29T15:45:09Z",
      "evidence": [
        "rollback drill passed"
      ],
      "attempts": 0
    },
    "gate_s8": {
      "status": "approved",
      "approver": "02-independent-verifier",
      "decided_by": "02-independent-verifier",
      "decided_at": "2026-10-29T15:45:11Z",
      "evidence": [
        "commands verified"
      ],
      "attempts": 0
    },
    "gate_s9": {
      "status": "approved",
      "approver": "human",
      "decided_by": "human:example",
      "decided_at": "2026-10-29T15:45:13Z",
      "evidence": [
        "patch queued for human review"
      ],
      "attempts": 0
    }
  },
  "tasks": {
    "TASK-001": {
      "task_id": "TASK-001",
      "stage": "s4_build",
      "owner": "12-fullstack-developer",
      "reqs": [
        "REQ-001",
        "REQ-002"
      ],
      "allowed_files": [
        "product/src/todo.py",
        "product/tests/test_todo.py"
      ],
      "deps": [],
      "status": "accepted",
      "attempts": 0,
      "artifacts": [
        "product/src/todo.py",
        "product/tests/test_todo.py"
      ],
      "lease": null
    },
    "TASK-002": {
      "task_id": "TASK-002",
      "stage": "s4_build",
      "owner": "12-fullstack-developer",
      "reqs": [
        "REQ-003"
      ],
      "allowed_files": [
        "product/src/todo.py",
        "product/tests/test_todo.py"
      ],
      "deps": [
        "TASK-001"
      ],
      "status": "accepted",
      "attempts": 0,
      "artifacts": [
        "product/src/todo.py",
        "product/tests/test_todo.py"
      ],
      "lease": null
    }
  },
  "veto_counters": {},
  "human_spec_approved": true,
  "restore_drill_passed": true,
  "last_event_hash": "bcd62182912746cba1c24a56e0b1190a85fda46bd1c7766e012dbb99a775ca1b",
  "event_count": 33,
  "created_at": "2026-10-29T15:44:51Z",
  "updated_at": "2026-10-29T15:45:13Z"
}
